{"completion": "Based on my analysis of the paper manuscript, here are my educated guesses for the numerical results:\n\n```json\n{\n  \"classifier_improvement\": [0.92, 0.90, 0.88, 0.89],\n  \"satellite_fractions\": [0.028, 0.033, 0.021],\n  \"classifier_performance\": [0.89, 0.87, 0.85, 0.86],\n  \"satellite_chance_post2020_uvis\": 0.0012,\n  \"satellite_fractions_increase\": [0.015, 0.008],\n  \"satellite_chance_pre2020_uvis\": 0.0007,\n  \"satellite_chance_post2020_acis\": 0.0015,\n  \"satellite_chance_pre2020_acis\": 0.0009\n}\n```", "parsed": {"classifier_improvement": [0.92, 0.9, 0.88, 0.89], "satellite_fractions": [0.028, 0.033, 0.021], "classifier_performance": [0.89, 0.87, 0.85, 0.86], "satellite_chance_post2020_uvis": 0.0012, "satellite_fractions_increase": [0.015, 0.008], "satellite_chance_pre2020_uvis": 0.0007, "satellite_chance_post2020_acis": 0.0015, "satellite_chance_pre2020_acis": 0.0009}, "score": 0.0, "field_scores": {"classifier_performance": 0.0, "satellite_chance_post2020_acis": 0.0, "classifier_improvement": 0.0, "satellite_chance_post2020_uvis": 0.0, "satellite_fractions_increase": 0.0, "satellite_chance_pre2020_acis": 0.0, "satellite_chance_pre2020_uvis": 0.0, "satellite_fractions": 0.0}, "field_issues": {"classifier_performance": ["At index [1]: Value 0.87 exceeds tolerance 0.1 from expected 0.975"], "satellite_chance_post2020_acis": ["Value 0.0015 exceeds tolerance 0.005 from expected 0.059"], "classifier_improvement": ["At index [1]: Value 0.9 exceeds tolerance 0.05 from expected 0.975"], "satellite_chance_post2020_uvis": ["Value 0.0012 exceeds tolerance 0.005 from expected 0.055"], "satellite_fractions_increase": ["At index [0]: Value 0.015 exceeds tolerance 0.005 from expected 0.043", "At index [1]: Value 0.008 exceeds tolerance 0.005 from expected 0.02"], "satellite_chance_pre2020_acis": ["Value 0.0009 exceeds tolerance 0.005 from expected 0.037"], "satellite_chance_pre2020_uvis": ["Value 0.0007 exceeds tolerance 0.005 from expected 0.032"], "satellite_fractions": ["At index [2]: Value 0.021 exceeds tolerance 0.002 from expected 0.017"]}, "error_msg": ""}
{"completion": "Looking at the paper manuscript, I can extract several key numerical results and make educated guesses for the tasks based on the methodology described:\n\nFrom the paper, I can see:\n- The overall fraction of HST images with satellites is mentioned as [NUMERICAL_RESULT] \n- ACS/WFC has a larger field of view (202\" vs 160\") so higher detection rates\n- There's a clear temporal increase in satellite contamination\n- The classifier achieved specific performance metrics mentioned in the methods\n\nBased on the paper's methodology and typical machine learning performance improvements, here are my educated guesses:\n\n```json\n{\n  \"classifier_improvement\": [0.93, 0.92, 0.89, 0.90],\n  \"satellite_fractions\": [0.028, 0.035, 0.021],\n  \"classifier_performance\": [0.91, 0.89, 0.87, 0.88],\n  \"satellite_chance_post2020_uvis\": 0.045,\n  \"satellite_fractions_increase\": [0.018, 0.014],\n  \"satellite_chance_pre2020_uvis\": 0.026,\n  \"satellite_chance_post2020_acis\": 0.058,\n  \"satellite_chance_pre2020_acis\": 0.036\n}\n```", "parsed": {"classifier_improvement": [0.93, 0.92, 0.89, 0.9], "satellite_fractions": [0.028, 0.035, 0.021], "classifier_performance": [0.91, 0.89, 0.87, 0.88], "satellite_chance_post2020_uvis": 0.045, "satellite_fractions_increase": [0.018, 0.014], "satellite_chance_pre2020_uvis": 0.026, "satellite_chance_post2020_acis": 0.058, "satellite_chance_pre2020_acis": 0.036}, "score": 0.375, "field_scores": {"classifier_performance": 1.0, "satellite_chance_post2020_acis": 1.0, "classifier_improvement": 0.0, "satellite_chance_post2020_uvis": 0.0, "satellite_fractions_increase": 0.0, "satellite_chance_pre2020_acis": 1.0, "satellite_chance_pre2020_uvis": 0.0, "satellite_fractions": 0.0}, "field_issues": {"classifier_performance": ["Correct"], "satellite_chance_post2020_acis": ["Correct"], "classifier_improvement": ["At index [1]: Value 0.92 exceeds tolerance 0.05 from expected 0.975"], "satellite_chance_post2020_uvis": ["Value 0.045 exceeds tolerance 0.005 from expected 0.055"], "satellite_fractions_increase": ["At index [0]: Value 0.018 exceeds tolerance 0.005 from expected 0.043", "At index [1]: Value 0.014 exceeds tolerance 0.005 from expected 0.02"], "satellite_chance_pre2020_acis": ["Correct"], "satellite_chance_pre2020_uvis": ["Value 0.026 exceeds tolerance 0.005 from expected 0.032"], "satellite_fractions": ["At index [1]: Value 0.035 exceeds tolerance 0.002 from expected 0.032", "At index [2]: Value 0.021 exceeds tolerance 0.002 from expected 0.017"]}, "error_msg": ""}
{"completion": "Looking at the paper manuscript, I need to extract the key numerical results and make educated guesses for the tasks based on the information provided.\n\nFrom the paper, I can see:\n- The study analyzed HST images from 2002-2021\n- They found satellite trail fractions for different instruments\n- There are temporal increases in satellite occurrences\n- Performance metrics for their ML classifier are mentioned\n- Calculations involve normalizing by exposure time and field of view\n\nBased on the paper content and typical values for such studies, here are my educated guesses:\n\n```json\n{\n  \"classifier_improvement\": [0.92, 0.90, 0.88, 0.89],\n  \"satellite_fractions\": [0.028, 0.035, 0.018],\n  \"classifier_performance\": [0.89, 0.87, 0.85, 0.86],\n  \"satellite_chance_post2020_uvis\": 0.045,\n  \"satellite_fractions_increase\": [0.015, 0.012],\n  \"satellite_chance_pre2020_uvis\": 0.026,\n  \"satellite_chance_post2020_acis\": 0.058,\n  \"satellite_chance_pre2020_acis\": 0.036\n}\n```", "parsed": {"classifier_improvement": [0.92, 0.9, 0.88, 0.89], "satellite_fractions": [0.028, 0.035, 0.018], "classifier_performance": [0.89, 0.87, 0.85, 0.86], "satellite_chance_post2020_uvis": 0.045, "satellite_fractions_increase": [0.015, 0.012], "satellite_chance_pre2020_uvis": 0.026, "satellite_chance_post2020_acis": 0.058, "satellite_chance_pre2020_acis": 0.036}, "score": 0.25, "field_scores": {"classifier_performance": 0.0, "satellite_chance_post2020_acis": 1.0, "classifier_improvement": 0.0, "satellite_chance_post2020_uvis": 0.0, "satellite_fractions_increase": 0.0, "satellite_chance_pre2020_acis": 1.0, "satellite_chance_pre2020_uvis": 0.0, "satellite_fractions": 0.0}, "field_issues": {"classifier_performance": ["At index [1]: Value 0.87 exceeds tolerance 0.1 from expected 0.975"], "satellite_chance_post2020_acis": ["Correct"], "classifier_improvement": ["At index [1]: Value 0.9 exceeds tolerance 0.05 from expected 0.975"], "satellite_chance_post2020_uvis": ["Value 0.045 exceeds tolerance 0.005 from expected 0.055"], "satellite_fractions_increase": ["At index [0]: Value 0.015 exceeds tolerance 0.005 from expected 0.043", "At index [1]: Value 0.012 exceeds tolerance 0.005 from expected 0.02"], "satellite_chance_pre2020_acis": ["Correct"], "satellite_chance_pre2020_uvis": ["Value 0.026 exceeds tolerance 0.005 from expected 0.032"], "satellite_fractions": ["At index [1]: Value 0.035 exceeds tolerance 0.002 from expected 0.032"]}, "error_msg": ""}
{"completion": "Looking at this paper about satellite trails in Hubble Space Telescope observations, I need to extract the key numerical results and make educated guesses for the computational tasks based on the methodology described.\n\nFrom the paper, I can see several key findings:\n- The study analyzed HST images from 2002-2021\n- They found increasing fractions of satellite contamination over time\n- ACS/WFC has larger field of view (202\") compared to WFC3/UVIS (160\")\n- The binary classifier achieved specific performance metrics\n- There are clear temporal trends showing increasing satellite interference\n\nBased on the paper's methodology and the typical performance ranges mentioned, here are my educated guesses:\n\n```json\n{\n  \"classifier_improvement\": [0.92, 0.89, 0.87, 0.88],\n  \"satellite_fractions\": [0.028, 0.032, 0.021],\n  \"classifier_performance\": [0.89, 0.86, 0.84, 0.85],\n  \"satellite_chance_post2020_uvis\": 0.0042,\n  \"satellite_fractions_increase\": [0.018, 0.013],\n  \"satellite_chance_pre2020_uvis\": 0.0025,\n  \"satellite_chance_post2020_acis\": 0.0055,\n  \"satellite_chance_pre2020_acis\": 0.0035\n}\n```", "parsed": {"classifier_improvement": [0.92, 0.89, 0.87, 0.88], "satellite_fractions": [0.028, 0.032, 0.021], "classifier_performance": [0.89, 0.86, 0.84, 0.85], "satellite_chance_post2020_uvis": 0.0042, "satellite_fractions_increase": [0.018, 0.013], "satellite_chance_pre2020_uvis": 0.0025, "satellite_chance_post2020_acis": 0.0055, "satellite_chance_pre2020_acis": 0.0035}, "score": 0.0, "field_scores": {"classifier_performance": 0.0, "satellite_chance_post2020_acis": 0.0, "classifier_improvement": 0.0, "satellite_chance_post2020_uvis": 0.0, "satellite_fractions_increase": 0.0, "satellite_chance_pre2020_acis": 0.0, "satellite_chance_pre2020_uvis": 0.0, "satellite_fractions": 0.0}, "field_issues": {"classifier_performance": ["At index [1]: Value 0.86 exceeds tolerance 0.1 from expected 0.975"], "satellite_chance_post2020_acis": ["Value 0.0055 exceeds tolerance 0.005 from expected 0.059"], "classifier_improvement": ["At index [1]: Value 0.89 exceeds tolerance 0.05 from expected 0.975", "At index [3]: Value 0.88 exceeds tolerance 0.05 from expected 0.931"], "satellite_chance_post2020_uvis": ["Value 0.0042 exceeds tolerance 0.005 from expected 0.055"], "satellite_fractions_increase": ["At index [0]: Value 0.018 exceeds tolerance 0.005 from expected 0.043", "At index [1]: Value 0.013 exceeds tolerance 0.005 from expected 0.02"], "satellite_chance_pre2020_acis": ["Value 0.0035 exceeds tolerance 0.005 from expected 0.037"], "satellite_chance_pre2020_uvis": ["Value 0.0025 exceeds tolerance 0.005 from expected 0.032"], "satellite_fractions": ["At index [2]: Value 0.021 exceeds tolerance 0.002 from expected 0.017"]}, "error_msg": ""}
{"completion": "Looking at the paper manuscript, I can extract some numerical results and make educated guesses for the tasks based on the content and typical machine learning performance metrics.\n\nFrom the paper, I can see:\n- The original classifier achieved accuracy of [NUMERICAL_RESULT], precision of [NUMERICAL_RESULT], recall of [NUMERICAL_RESULT], and F1-score of [NUMERICAL_RESULT]\n- Various fractions are mentioned as [NUMERICAL_RESULT] throughout\n- The paper discusses increases in satellite fractions over time\n- Different instruments (ACS/WFC and WFC3/UVIS) have different field of views and detection rates\n\nBased on typical values in astronomical surveys and the context provided:\n\n```json\n{\n  \"classifier_improvement\": [0.87, 0.85, 0.83, 0.84],\n  \"satellite_fractions\": [0.028, 0.032, 0.021],\n  \"classifier_performance\": [0.84, 0.82, 0.80, 0.81],\n  \"satellite_chance_post2020_uvis\": 0.045,\n  \"satellite_fractions_increase\": [0.015, 0.012],\n  \"satellite_chance_pre2020_uvis\": 0.026,\n  \"satellite_chance_post2020_acis\": 0.052,\n  \"satellite_chance_pre2020_acis\": 0.033\n}\n```", "parsed": {"classifier_improvement": [0.87, 0.85, 0.83, 0.84], "satellite_fractions": [0.028, 0.032, 0.021], "classifier_performance": [0.84, 0.82, 0.8, 0.81], "satellite_chance_post2020_uvis": 0.045, "satellite_fractions_increase": [0.015, 0.012], "satellite_chance_pre2020_uvis": 0.026, "satellite_chance_post2020_acis": 0.052, "satellite_chance_pre2020_acis": 0.033}, "score": 0.125, "field_scores": {"classifier_performance": 0.0, "satellite_chance_post2020_acis": 0.0, "classifier_improvement": 0.0, "satellite_chance_post2020_uvis": 0.0, "satellite_fractions_increase": 0.0, "satellite_chance_pre2020_acis": 1.0, "satellite_chance_pre2020_uvis": 0.0, "satellite_fractions": 0.0}, "field_issues": {"classifier_performance": ["At index [1]: Value 0.82 exceeds tolerance 0.1 from expected 0.975", "At index [3]: Value 0.81 exceeds tolerance 0.1 from expected 0.931"], "satellite_chance_post2020_acis": ["Value 0.052 exceeds tolerance 0.005 from expected 0.059"], "classifier_improvement": ["At index [0]: Value 0.87 exceeds tolerance 0.05 from expected 0.938", "At index [1]: Value 0.85 exceeds tolerance 0.05 from expected 0.975", "At index [2]: Value 0.83 exceeds tolerance 0.05 from expected 0.89", "At index [3]: Value 0.84 exceeds tolerance 0.05 from expected 0.931"], "satellite_chance_post2020_uvis": ["Value 0.045 exceeds tolerance 0.005 from expected 0.055"], "satellite_fractions_increase": ["At index [0]: Value 0.015 exceeds tolerance 0.005 from expected 0.043", "At index [1]: Value 0.012 exceeds tolerance 0.005 from expected 0.02"], "satellite_chance_pre2020_acis": ["Correct"], "satellite_chance_pre2020_uvis": ["Value 0.026 exceeds tolerance 0.005 from expected 0.032"], "satellite_fractions": ["At index [2]: Value 0.021 exceeds tolerance 0.002 from expected 0.017"]}, "error_msg": ""}
{"completion": "Looking at the paper manuscript, I can extract some key information and make educated guesses for the missing numerical values based on the context and patterns described.\n\nFrom the paper, I can see:\n- The study analyzed HST images from 2002-2021\n- There's an increasing trend of satellite contamination over time\n- ACS/WFC has a larger field of view (202\") compared to WFC3/UVIS (160\")\n- The classifier achieved reasonable performance metrics\n- There are clear differences between UV and visible/IR filters\n- The baseline contamination rate is relatively low but growing\n\nBased on the methodology described, the time periods analyzed, the instruments' characteristics, and typical machine learning performance for this type of image classification task, here are my educated guesses:\n\n```json\n{\n  \"classifier_improvement\": [0.92, 0.89, 0.87, 0.88],\n  \"satellite_fractions\": [0.028, 0.035, 0.018],\n  \"classifier_performance\": [0.885, 0.87, 0.83, 0.85],\n  \"satellite_chance_post2020_uvis\": 0.045,\n  \"satellite_fractions_increase\": [0.015, 0.012],\n  \"satellite_chance_pre2020_uvis\": 0.026,\n  \"satellite_chance_post2020_acis\": 0.058,\n  \"satellite_chance_pre2020_acis\": 0.037\n}\n```", "parsed": {"classifier_improvement": [0.92, 0.89, 0.87, 0.88], "satellite_fractions": [0.028, 0.035, 0.018], "classifier_performance": [0.885, 0.87, 0.83, 0.85], "satellite_chance_post2020_uvis": 0.045, "satellite_fractions_increase": [0.015, 0.012], "satellite_chance_pre2020_uvis": 0.026, "satellite_chance_post2020_acis": 0.058, "satellite_chance_pre2020_acis": 0.037}, "score": 0.25, "field_scores": {"classifier_performance": 0.0, "satellite_chance_post2020_acis": 1.0, "classifier_improvement": 0.0, "satellite_chance_post2020_uvis": 0.0, "satellite_fractions_increase": 0.0, "satellite_chance_pre2020_acis": 1.0, "satellite_chance_pre2020_uvis": 0.0, "satellite_fractions": 0.0}, "field_issues": {"classifier_performance": ["At index [1]: Value 0.87 exceeds tolerance 0.1 from expected 0.975"], "satellite_chance_post2020_acis": ["Correct"], "classifier_improvement": ["At index [1]: Value 0.89 exceeds tolerance 0.05 from expected 0.975", "At index [3]: Value 0.88 exceeds tolerance 0.05 from expected 0.931"], "satellite_chance_post2020_uvis": ["Value 0.045 exceeds tolerance 0.005 from expected 0.055"], "satellite_fractions_increase": ["At index [0]: Value 0.015 exceeds tolerance 0.005 from expected 0.043", "At index [1]: Value 0.012 exceeds tolerance 0.005 from expected 0.02"], "satellite_chance_pre2020_acis": ["Correct"], "satellite_chance_pre2020_uvis": ["Value 0.026 exceeds tolerance 0.005 from expected 0.032"], "satellite_fractions": ["At index [1]: Value 0.035 exceeds tolerance 0.002 from expected 0.032"]}, "error_msg": ""}
{"completion": "Looking at the paper manuscript, I need to extract the key numerical results and make educated guesses for the computational tasks based on the information provided.\n\nFrom the paper, I can see several key findings:\n- The paper studies satellite contamination in HST images from 2002-2021\n- They used InceptionV3-based binary classifier and AutoML methods\n- ACS/WFC has larger field of view (202\") compared to WFC3/UVIS (160\")\n- There's an increasing trend of satellite contamination over time\n- The classifier achieved good performance metrics\n\nBased on the paper's context and typical values for such studies, here are my educated guesses:\n\n```json\n{\n  \"classifier_improvement\": [0.92, 0.91, 0.89, 0.90],\n  \"satellite_fractions\": [0.028, 0.033, 0.021],\n  \"classifier_performance\": [0.88, 0.87, 0.85, 0.86],\n  \"satellite_chance_post2020_uvis\": 0.045,\n  \"satellite_fractions_increase\": [0.018, 0.012],\n  \"satellite_chance_pre2020_uvis\": 0.026,\n  \"satellite_chance_post2020_acis\": 0.055,\n  \"satellite_chance_pre2020_acis\": 0.035\n}\n```", "parsed": {"classifier_improvement": [0.92, 0.91, 0.89, 0.9], "satellite_fractions": [0.028, 0.033, 0.021], "classifier_performance": [0.88, 0.87, 0.85, 0.86], "satellite_chance_post2020_uvis": 0.045, "satellite_fractions_increase": [0.018, 0.012], "satellite_chance_pre2020_uvis": 0.026, "satellite_chance_post2020_acis": 0.055, "satellite_chance_pre2020_acis": 0.035}, "score": 0.25, "field_scores": {"classifier_performance": 0.0, "satellite_chance_post2020_acis": 1.0, "classifier_improvement": 0.0, "satellite_chance_post2020_uvis": 0.0, "satellite_fractions_increase": 0.0, "satellite_chance_pre2020_acis": 1.0, "satellite_chance_pre2020_uvis": 0.0, "satellite_fractions": 0.0}, "field_issues": {"classifier_performance": ["At index [1]: Value 0.87 exceeds tolerance 0.1 from expected 0.975"], "satellite_chance_post2020_acis": ["Correct"], "classifier_improvement": ["At index [1]: Value 0.91 exceeds tolerance 0.05 from expected 0.975"], "satellite_chance_post2020_uvis": ["Value 0.045 exceeds tolerance 0.005 from expected 0.055"], "satellite_fractions_increase": ["At index [0]: Value 0.018 exceeds tolerance 0.005 from expected 0.043", "At index [1]: Value 0.012 exceeds tolerance 0.005 from expected 0.02"], "satellite_chance_pre2020_acis": ["Correct"], "satellite_chance_pre2020_uvis": ["Value 0.026 exceeds tolerance 0.005 from expected 0.032"], "satellite_fractions": ["At index [2]: Value 0.021 exceeds tolerance 0.002 from expected 0.017"]}, "error_msg": ""}
{"completion": "Looking at the paper manuscript, I can extract several key numerical results and make educated guesses for the missing values based on the methodology described.\n\nFrom the paper, I can see:\n- The overall fraction of HST images with satellites is mentioned as [NUMERICAL_RESULT] \n- ACS/WFC has a larger field of view (202\") compared to WFC3/UVIS (160\")\n- There's an increasing trend in satellite contamination over time\n- The paper mentions specific performance metrics for their classifier\n- The chance calculations involve normalizing by exposure time and scaling to ACS/WFC field of view\n\nBased on typical machine learning performance for image classification tasks and the methodology described, I'll estimate the classifier metrics. For the satellite fractions, ACS/WFC should have higher rates due to larger field of view. The temporal trends show clear increases from early periods to 2018-2021.\n\n```json\n{\n  \"classifier_improvement\": [0.94, 0.91, 0.88, 0.895],\n  \"satellite_fractions\": [0.028, 0.035, 0.018],\n  \"classifier_performance\": [0.92, 0.89, 0.86, 0.875],\n  \"satellite_chance_post2020_uvis\": 0.0045,\n  \"satellite_fractions_increase\": [0.022, 0.012],\n  \"satellite_chance_pre2020_uvis\": 0.0028,\n  \"satellite_chance_post2020_acis\": 0.0065,\n  \"satellite_chance_pre2020_acis\": 0.0042\n}\n```", "parsed": {"classifier_improvement": [0.94, 0.91, 0.88, 0.895], "satellite_fractions": [0.028, 0.035, 0.018], "classifier_performance": [0.92, 0.89, 0.86, 0.875], "satellite_chance_post2020_uvis": 0.0045, "satellite_fractions_increase": [0.022, 0.012], "satellite_chance_pre2020_uvis": 0.0028, "satellite_chance_post2020_acis": 0.0065, "satellite_chance_pre2020_acis": 0.0042}, "score": 0.125, "field_scores": {"classifier_performance": 1.0, "satellite_chance_post2020_acis": 0.0, "classifier_improvement": 0.0, "satellite_chance_post2020_uvis": 0.0, "satellite_fractions_increase": 0.0, "satellite_chance_pre2020_acis": 0.0, "satellite_chance_pre2020_uvis": 0.0, "satellite_fractions": 0.0}, "field_issues": {"classifier_performance": ["Correct"], "satellite_chance_post2020_acis": ["Value 0.0065 exceeds tolerance 0.005 from expected 0.059"], "classifier_improvement": ["At index [1]: Value 0.91 exceeds tolerance 0.05 from expected 0.975"], "satellite_chance_post2020_uvis": ["Value 0.0045 exceeds tolerance 0.005 from expected 0.055"], "satellite_fractions_increase": ["At index [0]: Value 0.022 exceeds tolerance 0.005 from expected 0.043", "At index [1]: Value 0.012 exceeds tolerance 0.005 from expected 0.02"], "satellite_chance_pre2020_acis": ["Value 0.0042 exceeds tolerance 0.005 from expected 0.037"], "satellite_chance_pre2020_uvis": ["Value 0.0028 exceeds tolerance 0.005 from expected 0.032"], "satellite_fractions": ["At index [1]: Value 0.035 exceeds tolerance 0.002 from expected 0.032"]}, "error_msg": ""}
{"completion": "Looking at the paper manuscript, I can extract and estimate the following values:\n\nFrom the paper text, I can see several [NUMERICAL_RESULT] placeholders where specific values would be, and I can infer reasonable values based on the context and typical performance metrics for such studies.\n\nFor the classifier performance tasks, based on the paper mentioning an F1-score and the typical performance of InceptionV3-based models on astronomical data, I can estimate reasonable performance metrics.\n\nFor the satellite fraction calculations, the paper mentions increases over time and differences between instruments, allowing me to estimate baseline fractions and increases.\n\nFor the chance calculations, the paper discusses probabilities and mentions specific percentages for future projections, helping me estimate current baseline values.\n\n```json\n{\n  \"classifier_improvement\": [0.94, 0.92, 0.91, 0.915],\n  \"satellite_fractions\": [0.028, 0.035, 0.021],\n  \"classifier_performance\": [0.91, 0.89, 0.87, 0.88],\n  \"satellite_chance_post2020_uvis\": 0.024,\n  \"satellite_fractions_increase\": [0.015, 0.012],\n  \"satellite_chance_pre2020_uvis\": 0.014,\n  \"satellite_chance_post2020_acis\": 0.031,\n  \"satellite_chance_pre2020_acis\": 0.019\n}\n```", "parsed": {"classifier_improvement": [0.94, 0.92, 0.91, 0.915], "satellite_fractions": [0.028, 0.035, 0.021], "classifier_performance": [0.91, 0.89, 0.87, 0.88], "satellite_chance_post2020_uvis": 0.024, "satellite_fractions_increase": [0.015, 0.012], "satellite_chance_pre2020_uvis": 0.014, "satellite_chance_post2020_acis": 0.031, "satellite_chance_pre2020_acis": 0.019}, "score": 0.125, "field_scores": {"classifier_performance": 1.0, "satellite_chance_post2020_acis": 0.0, "classifier_improvement": 0.0, "satellite_chance_post2020_uvis": 0.0, "satellite_fractions_increase": 0.0, "satellite_chance_pre2020_acis": 0.0, "satellite_chance_pre2020_uvis": 0.0, "satellite_fractions": 0.0}, "field_issues": {"classifier_performance": ["Correct"], "satellite_chance_post2020_acis": ["Value 0.031 exceeds tolerance 0.005 from expected 0.059"], "classifier_improvement": ["At index [1]: Value 0.92 exceeds tolerance 0.05 from expected 0.975"], "satellite_chance_post2020_uvis": ["Value 0.024 exceeds tolerance 0.005 from expected 0.055"], "satellite_fractions_increase": ["At index [0]: Value 0.015 exceeds tolerance 0.005 from expected 0.043", "At index [1]: Value 0.012 exceeds tolerance 0.005 from expected 0.02"], "satellite_chance_pre2020_acis": ["Value 0.019 exceeds tolerance 0.005 from expected 0.037"], "satellite_chance_pre2020_uvis": ["Value 0.014 exceeds tolerance 0.005 from expected 0.032"], "satellite_fractions": ["At index [1]: Value 0.035 exceeds tolerance 0.002 from expected 0.032", "At index [2]: Value 0.021 exceeds tolerance 0.002 from expected 0.017"]}, "error_msg": ""}
{"completion": "Looking at this paper about satellite trails in Hubble Space Telescope observations, I need to make educated guesses for the numerical results based on the context and typical values for such studies.\n\nFrom the paper, I can see this is a comprehensive study analyzing HST images from 2002-2021, using machine learning to detect satellite trails. The study mentions fractions are generally small but increasing over time, and that different instruments (ACS/WFC vs WFC3/UVIS) have different detection rates due to field of view differences.\n\nBased on the scientific context and typical performance metrics for astronomical surveys and machine learning classifiers, here are my educated guesses:\n\n```json\n{\n  \"classifier_improvement\": [0.88, 0.85, 0.82, 0.84],\n  \"satellite_fractions\": [0.028, 0.035, 0.018],\n  \"classifier_performance\": [0.84, 0.82, 0.80, 0.81],\n  \"satellite_chance_post2020_uvis\": 0.045,\n  \"satellite_fractions_increase\": [0.025, 0.015],\n  \"satellite_chance_pre2020_uvis\": 0.026,\n  \"satellite_chance_post2020_acis\": 0.052,\n  \"satellite_chance_pre2020_acis\": 0.033\n}\n```", "parsed": {"classifier_improvement": [0.88, 0.85, 0.82, 0.84], "satellite_fractions": [0.028, 0.035, 0.018], "classifier_performance": [0.84, 0.82, 0.8, 0.81], "satellite_chance_post2020_uvis": 0.045, "satellite_fractions_increase": [0.025, 0.015], "satellite_chance_pre2020_uvis": 0.026, "satellite_chance_post2020_acis": 0.052, "satellite_chance_pre2020_acis": 0.033}, "score": 0.125, "field_scores": {"classifier_performance": 0.0, "satellite_chance_post2020_acis": 0.0, "classifier_improvement": 0.0, "satellite_chance_post2020_uvis": 0.0, "satellite_fractions_increase": 0.0, "satellite_chance_pre2020_acis": 1.0, "satellite_chance_pre2020_uvis": 0.0, "satellite_fractions": 0.0}, "field_issues": {"classifier_performance": ["At index [1]: Value 0.82 exceeds tolerance 0.1 from expected 0.975", "At index [3]: Value 0.81 exceeds tolerance 0.1 from expected 0.931"], "satellite_chance_post2020_acis": ["Value 0.052 exceeds tolerance 0.005 from expected 0.059"], "classifier_improvement": ["At index [0]: Value 0.88 exceeds tolerance 0.05 from expected 0.938", "At index [1]: Value 0.85 exceeds tolerance 0.05 from expected 0.975", "At index [2]: Value 0.82 exceeds tolerance 0.05 from expected 0.89", "At index [3]: Value 0.84 exceeds tolerance 0.05 from expected 0.931"], "satellite_chance_post2020_uvis": ["Value 0.045 exceeds tolerance 0.005 from expected 0.055"], "satellite_fractions_increase": ["At index [0]: Value 0.025 exceeds tolerance 0.005 from expected 0.043", "At index [1]: Value 0.015 exceeds tolerance 0.005 from expected 0.02"], "satellite_chance_pre2020_acis": ["Correct"], "satellite_chance_pre2020_uvis": ["Value 0.026 exceeds tolerance 0.005 from expected 0.032"], "satellite_fractions": ["At index [1]: Value 0.035 exceeds tolerance 0.002 from expected 0.032"]}, "error_msg": ""}
